{
  "kind": "FloatingPointPrecisionScanRequest",
  "schema_version": "1.0",
  "request_id": "example-request",
  "project_root": "/workspace/project",
  "source_profile": "x86_64-linux-gnu-clang21@1.0",
  "target_profile": "riscv64-linux-gnu-lp64d-clang21@1.0",
  "input": {"compile_commands": "build/compile_commands.json"},
  "rules": {"enabled": []},
  "budgets": {"wall_seconds": 60, "max_files": 1000, "max_response_depth": 8, "max_response_bytes": 1048576}
}
